{
  "approval_evidence": {
    "actor_expression": "session-user",
    "approved_at": "2026-07-23T08:10:21+09:00",
    "decision": "approved",
    "scope": {
      "acceptance_criteria": true,
      "accepted_decisions": true,
      "non_goals": true,
      "remote_policy": true,
      "stop_conditions": true,
      "verification": true
    },
    "subject": "spec_binding"
  },
  "artifact_root": "knowledge/wiki/syntheses/direct-github-projects-task-management",
  "delivery_intent": "local_only",
  "epic_id": "direct-github-projects-task-management",
  "schema_version": 2,
  "spec_binding": {
    "path": "knowledge/wiki/syntheses/direct-github-projects-task-management/spec.md",
    "sha256": "9200996f2ed046ecb351fad96930c6e4e9a1580fdde14472ecc8b68b98f36c94"
  },
  "work_items": [
    {
      "acceptance_criteria": [
        "standalone skillのcaller-owned target、Issue-backed task、repository work-unit boundary、host-neutralかつruntime-freeな構造をcontract testsで固定する",
        "focused unittestとskill-creator validatorを成功させる"
      ],
      "dependencies": [],
      "id": "DGPTM-001",
      "non_goals": [
        "旧plugin削除、全workflow reference、live MCP callをこのIssueで行わない"
      ],
      "source": {
        "path": "knowledge/wiki/syntheses/direct-github-projects-task-management/issues.md",
        "type": "local"
      },
      "title": "standalone skillのexecutable contractをtest-firstで固定する",
      "verification": [
        "PYTHONPYCACHEPREFIX=/private/tmp/skills-pycache python3 -m unittest discover -s skills/task-management/tests",
        "PYTHONPYCACHEPREFIX=/private/tmp/skills-pycache python3 /Users/omitsuhashi/.codex/skills/.system/skill-creator/scripts/quick_validate.py skills/task-management",
        "git diff --check"
      ],
      "write_scope": [
        "path:skills/task-management"
      ]
    },
    {
      "acceptance_criteria": [
        "Projectとrepositoryの解決順、Issue template、Project fields、terminal mapping、approval policy、capability check、partial failure continuationをskill referencesとtestsで固定する",
        "GitHub MCP以外のruntime fallbackと別skill必須dependencyを持たない"
      ],
      "dependencies": [
        "DGPTM-001"
      ],
      "id": "DGPTM-002",
      "non_goals": [
        "caller config保存path、MCP function名、Project schema setupをtask flowの共通runtimeとして実装しない"
      ],
      "source": {
        "path": "knowledge/wiki/syntheses/direct-github-projects-task-management/issues.md",
        "type": "local"
      },
      "title": "direct GitHub MCPのtask workflowと安全境界を実装する",
      "verification": [
        "PYTHONPYCACHEPREFIX=/private/tmp/skills-pycache python3 -m unittest discover -s skills/task-management/tests",
        "PYTHONPYCACHEPREFIX=/private/tmp/skills-pycache python3 scripts/validate_dual_host_compatibility.py --skill skills/task-management",
        "PYTHONPYCACHEPREFIX=/private/tmp/skills-pycache python3 /Users/omitsuhashi/.codex/skills/.system/skill-creator/scripts/quick_validate.py skills/task-management",
        "git diff --check"
      ],
      "write_scope": [
        "path:skills/task-management"
      ]
    },
    {
      "acceptance_criteria": [
        "plugins/task-management全体を削除し、CIとrepository regressionをstandalone skill testsへ切り替える",
        "active codeとworkflowから旧plugin pathとregistered read tool dependencyを除去する"
      ],
      "dependencies": [
        "DGPTM-002"
      ],
      "id": "DGPTM-003",
      "non_goals": [
        "historical wiki artifact、repository-wide compatibility validator、live installed stateを削除または変更しない"
      ],
      "source": {
        "path": "knowledge/wiki/syntheses/direct-github-projects-task-management/issues.md",
        "type": "local"
      },
      "title": "旧task-management pluginを削除してCIと回帰契約を移行する",
      "verification": [
        "PYTHONPYCACHEPREFIX=/private/tmp/skills-pycache python3 -m unittest discover -s skills/task-management/tests",
        "PYTHONPYCACHEPREFIX=/private/tmp/skills-pycache python3 scripts/test_dual_host_ci_workflow.py",
        "PYTHONPYCACHEPREFIX=/private/tmp/skills-pycache python3 scripts/test_loop_autonomous_gates_ledger.py",
        "PYTHONPYCACHEPREFIX=/private/tmp/skills-pycache python3 -m unittest discover -s skills/decide-in-order/tests",
        "git diff --check"
      ],
      "write_scope": [
        "path:plugins/task-management",
        "path:.github/workflows/skill-architecture.yml",
        "path:scripts/test_dual_host_ci_workflow.py",
        "path:scripts/test_loop_autonomous_gates_ledger.py",
        "path:skills/task-management/tests"
      ]
    },
    {
      "acceptance_criteria": [
        "active knowledgeを新contractへ切り替え、historical artifactを変更せず保持する",
        "fresh evaluator 8 scenarioと全local verificationを成功させ、Issue ledgerへ証跡を集約する"
      ],
      "dependencies": [
        "DGPTM-003"
      ],
      "id": "DGPTM-004",
      "non_goals": [
        "live MCP成功の偽装、historical completion evidenceの再利用、remote deliveryを行わない"
      ],
      "source": {
        "path": "knowledge/wiki/syntheses/direct-github-projects-task-management/issues.md",
        "type": "local"
      },
      "title": "historical supersessionと統合検証を完了する",
      "verification": [
        "PYTHONPYCACHEPREFIX=/private/tmp/skills-pycache python3 -m unittest discover -s skills/task-management/tests",
        "PYTHONPYCACHEPREFIX=/private/tmp/skills-pycache python3 -m unittest discover -s skills/decide-in-order/tests",
        "PYTHONPYCACHEPREFIX=/private/tmp/skills-pycache python3 -m unittest discover -s skills/llm-wiki/tests",
        "PYTHONPYCACHEPREFIX=/private/tmp/skills-pycache python3 -m unittest discover -s scripts -p 'test_*.py'",
        "PYTHONPYCACHEPREFIX=/private/tmp/skills-pycache python3 scripts/validate_skill_architecture.py --all",
        "PYTHONPYCACHEPREFIX=/private/tmp/skills-pycache python3 scripts/validate_dual_host_compatibility.py --skill skills/task-management",
        "git diff --check"
      ],
      "write_scope": [
        "path:knowledge/index.md",
        "path:knowledge/log.md",
        "path:knowledge/wiki/syntheses/direct-github-projects-task-management/issues.md"
      ]
    }
  ]
}
